{
  "name": "Microsoft Entra get-before-create finds existing User",
  "description": "Entra's provisioning flow filters by the joining userName before deciding whether to create.",
  "provider": "entra",
  "area": "scim",
  "request": {
    "method": "GET",
    "path": "/scim/v2/Users",
    "headers": {
      "authorization": "Bearer fixture-scim-token"
    },
    "query": {
      "filter": "userName eq \"ada@example.test\""
    }
  },
  "expected": {
    "status": 200,
    "bodyContains": {
      "schemas": ["urn:ietf:params:scim:api:messages:2.0:ListResponse"],
      "totalResults": 1,
      "startIndex": 1,
      "itemsPerPage": 1
    }
  },
  "provenance": "official-docs",
  "sourceUrl": "https://learn.microsoft.com/en-us/entra/identity/app-provisioning/use-scim-to-provision-users-and-groups",
  "lastVerified": "2026-07-22",
  "status": "implemented"
}
