{
  "name": "RFC 7644 User resource type discovery",
  "description": "The User ResourceType item identifies the Users endpoint and core user schema.",
  "provider": "okta",
  "area": "scim",
  "request": {
    "method": "GET",
    "path": "/scim/v2/ResourceTypes/User",
    "headers": {
      "authorization": "Bearer fixture-scim-token"
    }
  },
  "expected": {
    "status": 200,
    "bodyContains": {
      "schemas": ["urn:ietf:params:scim:schemas:core:2.0:ResourceType"],
      "id": "User",
      "name": "User",
      "endpoint": "/Users",
      "schema": "urn:ietf:params:scim:schemas:core:2.0:User"
    }
  },
  "provenance": "rfc",
  "sourceUrl": "https://datatracker.ietf.org/doc/html/rfc7643#section-6",
  "lastVerified": "2026-07-22",
  "status": "implemented"
}
