{
  "name": "RFC 7644 reject pathless PATCH remove",
  "description": "A remove operation without an attribute path is invalid.",
  "provider": "okta",
  "area": "scim",
  "request": {
    "method": "PATCH",
    "path": "/scim/v2/Users/usr_ada",
    "headers": {
      "authorization": "Bearer fixture-scim-token",
      "content-type": "application/scim+json"
    },
    "body": {
      "schemas": ["urn:ietf:params:scim:api:messages:2.0:PatchOp"],
      "Operations": [
        {
          "op": "remove"
        }
      ]
    }
  },
  "expected": {
    "status": 400,
    "bodyContains": {
      "schemas": ["urn:ietf:params:scim:api:messages:2.0:Error"],
      "status": "400",
      "scimType": "invalidPath"
    }
  },
  "provenance": "rfc",
  "sourceUrl": "https://datatracker.ietf.org/doc/html/rfc7644#section-3.5.2",
  "lastVerified": "2026-07-22",
  "status": "implemented"
}
