{
  "name": "Okta denied device authorization",
  "description": "A user-denied device request returns access_denied to the polling client.",
  "provider": "okta",
  "area": "errors",
  "request": {
    "method": "POST",
    "path": "/e/acme/oauth2/default/v1/token",
    "form": {
      "grant_type": "urn:ietf:params:oauth:grant-type:device_code",
      "device_code": "fixture-denied-device-code",
      "client_id": "0oaMockClient"
    }
  },
  "expected": { "status": 400, "bodyContains": { "error": "access_denied" } },
  "provenance": "rfc",
  "sourceUrl": "https://www.rfc-editor.org/rfc/rfc8628.html#section-3.5",
  "lastVerified": "2026-07-22",
  "status": "documented",
  "notes": "Denial state and error are asserted in the focused core suite."
}
