{
  "name": "RFC 7644 list seeded Groups",
  "description": "A collection read returns the seeded Engineering group in a ListResponse.",
  "provider": "okta",
  "area": "scim",
  "request": {
    "method": "GET",
    "path": "/scim/v2/Groups",
    "headers": {
      "authorization": "Bearer fixture-scim-token"
    }
  },
  "expected": {
    "status": 200,
    "bodyContains": {
      "schemas": ["urn:ietf:params:scim:api:messages:2.0:ListResponse"],
      "totalResults": 1,
      "startIndex": 1,
      "itemsPerPage": 1
    }
  },
  "provenance": "rfc",
  "sourceUrl": "https://datatracker.ietf.org/doc/html/rfc7644#section-3.4",
  "lastVerified": "2026-07-22",
  "status": "implemented"
}
